{"$schema":"https://json-schema.org/draft/2020-12/schema","$id":"https://tiber-data.local/contracts/season-intelligence-delta.v1.schema.json","title":"Season Intelligence Delta v1","type":"object","additionalProperties":false,"required":["delta_id","schema_version","parent_snapshot_id","as_of","events"],"properties":{"delta_id":{"type":"string","pattern":"^sid-[0-9]{4}-w[0-9]{2}-[a-z0-9-]+$"},"schema_version":{"const":"season-intelligence-delta.v1"},"parent_snapshot_id":{"type":"string"},"as_of":{"type":"string","format":"date-time"},"events":{"type":"array","minItems":1,"items":{"$ref":"season-intelligence-event.v1.schema.json"}}}}
