{"delta_id":"sid-2026-w01-2026-09-15","schema_version":"season-intelligence-delta.v1","parent_snapshot_id":"sis-2026-w01-post-mnf","as_of":"2026-09-15T17:51:00-04:00","events":[{"event_id":"sie-2026-w01-zay-day-to-day-delta","schema_version":"season-intelligence-event.v1","season":2026,"week":1,"occurred_at":null,"known_at":"2026-09-15T17:51:00-04:00","subject":{"entity_type":"player","display_name":"Zay Flowers","team":"BAL","canonical_id":null},"event_type":"readiness","fact_status":"CONFIRMED","summary":"Head coach Jesse Minter described Flowers as day-to-day and said he felt good about the situation, reducing the severity tail while preserving recurrence risk.","mechanisms":["injury_recurring","availability"],"sources":[{"source_name":"Baltimore Ravens","source_role":"team","url":"https://www.baltimoreravens.com/news/zay-flowers-jakobi-lane-injury-updates-ravens-jesse-minter","published_at":null,"retrieved_at":"2026-09-15T17:51:00-04:00","quality":"HIGH"}],"confidence":0.99,"fantasy_impact":{"direction":"UP","magnitude":"MEDIUM","time_horizon":"WEEK_2","uncertainty":"MEDIUM","role_fragility":"MEDIUM","affected_entities":["Zay Flowers","Rashod Bateman","BAL WR room"]},"model_treatment":"PARTIAL_UPDATE","next_required_evidence":["Wednesday practice participation","Official Week 2 game designation"],"recheck_after":"2026-09-16T18:00:00-04:00","supersedes_event_id":"sie-2026-w01-zay-hamstring-aggravation","notes":[]},{"event_id":"sie-2026-w01-ravens-wr-depth-delta","schema_version":"season-intelligence-event.v1","season":2026,"week":1,"occurred_at":null,"known_at":"2026-09-15T17:51:00-04:00","subject":{"entity_type":"team","display_name":"Baltimore Ravens","team":"BAL","canonical_id":null},"event_type":"transaction","fact_status":"CONFIRMED","summary":"Baltimore signed Gage Larvadain to the practice squad after the Flowers/Lane injuries, confirming a need for additional receiver depth but not changing the top role by itself.","mechanisms":["availability","other"],"sources":[{"source_name":"Baltimore Ravens","source_role":"team","url":"https://www.baltimoreravens.com/news/ravens-sign-wide-receiver-release-jake-moody-gage-larvadain-jakobi-lane-zay-flowers","published_at":null,"retrieved_at":"2026-09-15T17:51:00-04:00","quality":"HIGH"}],"confidence":0.99,"fantasy_impact":{"direction":"NEUTRAL","magnitude":"LOW","time_horizon":"WEEK_2","uncertainty":"MEDIUM","role_fragility":"NOT_APPLICABLE","affected_entities":["Rashod Bateman","Gage Larvadain","BAL WR room"]},"model_treatment":"CONTEXT_ONLY","next_required_evidence":["Game-day elevation","Flowers/Lane statuses"],"recheck_after":"2026-09-19T16:00:00-04:00","supersedes_event_id":null,"notes":[]},{"event_id":"sie-2026-w01-delane-mri-delta","schema_version":"season-intelligence-event.v1","season":2026,"week":1,"occurred_at":null,"known_at":"2026-09-15T17:51:00-04:00","subject":{"entity_type":"player","display_name":"Mansoor Delane","team":"KC","canonical_id":null},"event_type":"injury","fact_status":"REPORTED","summary":"X-rays were negative after Delane's shoulder injury; an MRI was scheduled Tuesday, leaving Week 2 availability unresolved.","mechanisms":["availability","defensive_matchup"],"sources":[{"source_name":"NFL.com","source_role":"league","url":"https://amp.nfl.com/news/nfl-news-roundup-latest-league-updates-from-tuesday-sept-15","published_at":null,"retrieved_at":"2026-09-15T17:51:00-04:00","quality":"HIGH"}],"confidence":0.98,"fantasy_impact":{"direction":"UP","magnitude":"LOW","time_horizon":"WEEK_2","uncertainty":"HIGH","role_fragility":"NOT_APPLICABLE","affected_entities":["Mansoor Delane","KC secondary"]},"model_treatment":"WATCH_ONLY","next_required_evidence":["MRI result","Wednesday practice participation"],"recheck_after":"2026-09-16T18:00:00-04:00","supersedes_event_id":"sie-2026-w01-delane-shoulder-in-game","notes":[]},{"event_id":"sie-2026-w01-omar-cooper-week-to-week","schema_version":"season-intelligence-event.v1","season":2026,"week":1,"occurred_at":null,"known_at":"2026-09-15T17:51:00-04:00","subject":{"entity_type":"player","display_name":"Omar Cooper Jr.","team":"NYJ","canonical_id":null},"event_type":"injury","fact_status":"REPORTED","summary":"MRI produced positive news after an ankle sprain; Cooper is week to week with hope of returning within four weeks.","mechanisms":["availability"],"sources":[{"source_name":"NFL.com","source_role":"league","url":"https://amp.nfl.com/news/nfl-news-roundup-latest-league-updates-from-tuesday-sept-15","published_at":null,"retrieved_at":"2026-09-15T17:51:00-04:00","quality":"HIGH"}],"confidence":0.98,"fantasy_impact":{"direction":"DOWN","magnitude":"MEDIUM","time_horizon":"SHORT_TERM","uncertainty":"MEDIUM","role_fragility":"NOT_APPLICABLE","affected_entities":["Omar Cooper Jr.","NYJ pass catchers"]},"model_treatment":"PARTIAL_UPDATE","next_required_evidence":["Practice progression","Week 2/3 game designation"],"recheck_after":"2026-09-16T18:00:00-04:00","supersedes_event_id":null,"notes":[]}]}
